{
  "$schema": "http://json-schema.org/draft-07/schema#",
  "title": "Articles API Contract",
  "description": "Schema for articles.json endpoint",
  "type": "array",
  "items": {
    "type": "object",
    "properties": {
      "title": {
        "type": [
          "string",
          "null"
        ]
      },
      "author": {
        "type": [
          "string",
          "null"
        ]
      },
      "publishedDate": {
        "type": [
          "string",
          "null"
        ],
        "format": "date-time"
      },
      "content": {
        "type": [
          "string",
          "null"
        ]
      }
    },
    "required": [],
    "additionalProperties": true
  }
}
