[
  {
    "title": "Miami Dolphins Schedule 2026",
    "author": "Javier",
    "publishedDate": "2026-02-11T10:00:00Z",
    "content": "The Dolphins will play..."
  },
  {
    "title": "Draft Preview",
    "author": null,
    "publishedDate": null,
    "content": "Preview of the upcoming draft."
  }
]
